"1509555156056223747","2022-03-31T15:36:10.000Z","5751","Hello from the pinkest place ever…here in Kyiv a pastry shop now cooking meals for the people of Ukraine! This team didn’t even know each other 30 days ago &amp; now are true @WCKitchen Food Fighters 💪 I can’t wait to come back on vacation when there is peace! #ChefsForUkraine 🇺🇦 https://t.co/0DgnFnWgc4","ChefsForUkraine",,,,,,,,,,"1509555156056223747","98","880","https://twitter.com/chefjoseandres/status/1509555156056223747",,,,"promotable_user",,,"none",,"false","2009-09-10T20:06:04.000Z","false","We all are Citizens of the World. What's good for you, must be good for all. If you are lost, share a plate of food with a stranger...you will find who you are.","false","0","21698",,,"1128482",,"1398","true","true","73206956","73206956","false","false",,"6098","Washington, DC and the world","6060",,"José Andrés","1128482",,"B0A397","http://abs.twimg.com/images/themes/theme1/bg.png","https://abs.twimg.com/images/themes/theme1/bg.png","false",,"https://pbs.twimg.com/profile_banners/73206956/1646246053",,"http://pbs.twimg.com/profile_images/1463525607212564486/2xnBjH_m_normal.jpg","https://pbs.twimg.com/profile_images/1463525607212564486/2xnBjH_m_normal.jpg","FFFFFF","DDEEF6","333333","true","false","false","chefjoseandres","51219",,"none","https://t.co/DL43y32qYO",,"true",,"156653779","World Central Kitchen","WCKitchen",,,,,,
"1509575031608815620","2022-03-31T16:55:08.000Z","45","Russia's war of aggression against #Ukraine is a criminal offense. Anyone publicly approving the war may be liable to prosecution in Germany. This applies to using the ""Z"" symbol, too. German security authorities are keeping an eye on the use of the symbol. - Ministry of Interior https://t.co/ECVwsSQgyL","Ukraine",,,,,,,,,,"1509575031608815620","9","14","https://twitter.com/zagobrothers/status/1509575031608815620",,,,"none",,,"none",,"false","2015-05-29T14:23:43.000Z","false","Designer/Illustrator/Cartoonist https://t.co/4VWPl1LIjW","false","0","24164",,,"466",,"442","true","true","3302845115","3302845115","false","false",,"4","Philadelphia, PA","172",,"ZagoBrothers","466",,"000000","http://abs.twimg.com/images/themes/theme1/bg.png","https://abs.twimg.com/images/themes/theme1/bg.png","false",,"https://pbs.twimg.com/profile_banners/3302845115/1608059645",,"http://pbs.twimg.com/profile_images/1508858201890041858/VTWllc6O_normal.jpg","https://pbs.twimg.com/profile_images/1508858201890041858/VTWllc6O_normal.jpg","000000","000000","000000","false","false","false","zagobrothers","734",,"none","https://t.co/4VWPl1LIjW",,"false",,,,,,,,,,
"1509581783821651968","2022-03-31T17:21:58.000Z","15","REMINDER‼️‼️

💥ONE OF THE MOST EVIL PERSON ON THIS PLANET 💥

💥 I SET THE FOUNDATION IN 1990 💥

💥 WERE ? 💥

💥 UKRAINE 💥 https://t.co/BHN3aYk7QU",,,,,,,,,,,"1509581783821651968","0","13","https://twitter.com/Xx17965797/status/1509581783821651968",,,,"none",,,"none",,"false","2021-09-10T07:34:51.000Z","false","","false","0","5507",,,"3444",,"4969","false","true","1436231596944863200","1436231596944863235","false","false",,"4","","3873",,"Xx","3444",,"F5F8FA",,,"false",,,,"http://pbs.twimg.com/profile_images/1474677185378140170/0xtp27db_normal.jpg","https://pbs.twimg.com/profile_images/1474677185378140170/0xtp27db_normal.jpg","C0DEED","DDEEF6","333333","true","false","false","Xx17965797","11201",,"none",,,"false",,,,,,,,,,
"1509551804505276420","2022-03-31T15:22:50.000Z","1571","Soldier Volodimir holds the hand of his girlfriend Tanya while saying goodbye at the train station in Lviv, #Ukraine. He departs to Kramatorsk, to fight in the war.

Photo: Ilvy Njiokiktjien. https://t.co/Ql7Q0I90ap","Ukraine",,,,,,,,,,"1509551804505276420","46","369","https://twitter.com/KyivPost/status/1509551804505276420",,,,"promotable_user",,,"none",,"false","2008-03-09T08:15:00.000Z","false","The award-winning Kyiv Post is the top international source of English-language news about Ukraine since 1995.","false","0","2963",,,"374567",,"1573","true","true","14106476","14106476","false","false",,"5733","#Kyiv, #Ukraine","23188",,"KyivPost","374567",,"C0DEED","http://abs.twimg.com/images/themes/theme1/bg.png","https://abs.twimg.com/images/themes/theme1/bg.png","true",,"https://pbs.twimg.com/profile_banners/14106476/1645175632",,"http://pbs.twimg.com/profile_images/1344614626479271942/jdh5Op0q_normal.jpg","https://pbs.twimg.com/profile_images/1344614626479271942/jdh5Op0q_normal.jpg","000000","DDEEF6","333333","true","false","false","KyivPost","56632",,"none","https://t.co/lHlutZvoAu",,"true",,,,,,,,,,
"1509547194935877632","2022-03-31T15:04:31.000Z","192","Rubles instead of hryvnias in the occupied territories - invaders yet again violate both international humanitarian law and Ukrainian law. @GP_Ukraine has launched an investigation into the forced restriction of the use of the national currency 🇺🇦
#RussianWarCrimes https://t.co/EGVIPSs4Ps","RussianWarCrimes",,,,,,,,,,"1509547194935877632","7","76","https://twitter.com/VenediktovaIV/status/1509547194935877632",,,,"promotable_user",,,"none",,"false","2022-02-26T11:13:40.000Z","false","Генеральний прокурор. Prosecutor General of Ukraine","false","0","172",,,"8952",,"63","true","false","1497530041504350200","1497530041504350208","false","false",,"157","Україна","86",,"Iryna Venediktova","8952",,"F5F8FA",,,"false",,"https://pbs.twimg.com/profile_banners/1497530041504350208/1646045003",,"http://pbs.twimg.com/profile_images/1497535443163877376/eE_efRq8_normal.jpg","https://pbs.twimg.com/profile_images/1497535443163877376/eE_efRq8_normal.jpg","C0DEED","DDEEF6","333333","true","false","false","VenediktovaIV","260",,"none","https://t.co/UUAC31HasQ",,"true",,"2777916078","Офіс Генерального прокурора","GP_Ukraine",,,,,,
"1509540783543799808","2022-03-31T14:39:03.000Z","2305","NEW: The UK has sanctioned Russian Colonel General Mikhail Mizintsev, accused of ordering shelling of civilian areas Ukraine’s Mariupol.

Mariupol has been mostly surrounded &amp; besieged for 31 days. 🇷🇺 siege has killed 5,000 people. Mizintsev is known as the ‘butcher’ of Mariupol https://t.co/bdRR5zsxji",,,,,,,,,,,"1509540783543799808","151","658","https://twitter.com/JackDetsch/status/1509540783543799808",,,,"promotable_user",,,"none",,"false","2012-08-27T18:38:31.000Z","false","Bringing you stories from the Pentagon. National security reporter @foreignpolicy. Tell me something new: Signal → 510-439-7894 / email → jack.detsch@gmail.com","false","0","23472",,,"83713",,"4998","false","true","785237870","785237870","false","false",,"2287","Read our newsletter 👇","1521",,"Jack Detsch","83713",,"C6E2EE","http://abs.twimg.com/images/themes/theme2/bg.gif","https://abs.twimg.com/images/themes/theme2/bg.gif","false",,"https://pbs.twimg.com/profile_banners/785237870/1618022054",,"http://pbs.twimg.com/profile_images/1400086566119383050/EuSuuTqD_normal.jpg","https://pbs.twimg.com/profile_images/1400086566119383050/EuSuuTqD_normal.jpg","C6E2EE","DAECF4","663B12","true","false","false","JackDetsch","19024",,"none","https://t.co/LILiBnpYg5",,"true",,,,,,,,,,
"1509545936640430086","2022-03-31T14:59:31.000Z","685","Mike Pence's big 2024 rehab tour features him talking tough about Putin to gain distance from Trump. So let's not let them memory-hole Pence's neck-deep involvement in the Ukraine scandal or his slimy apologetics for Trump's Putinism. Here's a refresher:
https://t.co/VB9KwOGkGb",,,,,,,,,,,"1509545936640430086","22","296","https://twitter.com/ThePlumLineGS/status/1509545936640430086","washingtonpost.com/opinions/2022/…","https://www.washingtonpost.com/opinions/2022/03/31/mike-pence-rehab-tour-trump-ukraine/","https://t.co/VB9KwOGkGb","promotable_user",,,"none",,"false","2009-02-10T12:04:17.000Z","false","A blog about politics, politics, and politics","false","0","5707",,,"319161",,"3758","true","true","20508720","20508720","false","false",,"6446","","5795",,"Greg Sargent","319161",,"C0DEED","http://abs.twimg.com/images/themes/theme1/bg.png","https://abs.twimg.com/images/themes/theme1/bg.png","false",,"https://pbs.twimg.com/profile_banners/20508720/1533919694",,"http://pbs.twimg.com/profile_images/1027959547997110273/z8InKK69_normal.jpg","https://pbs.twimg.com/profile_images/1027959547997110273/z8InKK69_normal.jpg","C0DEED","DDEEF6","333333","true","false","false","ThePlumLineGS","164479",,"none","https://t.co/Bx7pTZ6DYZ",,"true",,,,,,,,,,
"1509581922028113922","2022-03-31T17:22:31.000Z","149","""We need to continue to supply weapons to Ukraine. NATO allies will continue to provide, supply weapons to Ukraine as long as necessary. This is extremely important because Ukraine is fighting a war for freedom, for democracy, for our shared values, "" - @jensstoltenberg",,,,,,,,,,,"1509581922028113922","5","35","https://twitter.com/IuliiaMendel/status/1509581922028113922",,,,"none",,,"none",,"false","2013-05-13T05:09:57.000Z","false","ex Spokesperson to the President of Ukraine @ZelenskyyUa","false","0","2518",,,"38611",,"760","true","false","1424639970","1424639970","false","false",,"895","Украина","632",,"Iuliia Mendel","38611",,"000000","http://abs.twimg.com/images/themes/theme1/bg.png","https://abs.twimg.com/images/themes/theme1/bg.png","false",,"https://pbs.twimg.com/profile_banners/1424639970/1645649149",,"http://pbs.twimg.com/profile_images/1323654498548699136/2QQkS6ld_normal.jpg","https://pbs.twimg.com/profile_images/1323654498548699136/2QQkS6ld_normal.jpg","000000","000000","000000","false","false","false","IuliiaMendel","4014",,"none",,,"true",,"20796069","Jens Stoltenberg","jensstoltenberg",,,,,,
"1509582331115413511","2022-03-31T17:24:09.000Z","358","Ukrainian historian Yaroslav Hrytsak warns that the current 🇷🇺 war is a war against Europe. The 🇷🇺 invasion was almost inevitable; but for 1st time in history, 🇺🇦 has support of whole West. Putin has no chance &amp; peace is only a matter of time and price.

https://t.co/DRdrs012vf",,,,,,,,,,,"1509582331115413511","9","96","https://twitter.com/EuromaidanPress/status/1509582331115413511","euromaidanpress.com/2022/03/31/put…","https://euromaidanpress.com/2022/03/31/putin-is-at-war-with-the-west-in-ukraine-historian-hrytsak-on-the-main-reason-of-war/?swcfpc=1","https://t.co/DRdrs012vf","promotable_user",,,"none",,"false","2014-06-29T17:47:52.000Z","false","News and views from Ukraine. Support our independent grassroots media outlet here: https://t.co/02IG5AcqvC","false","0","5288",,,"169412",,"1326","true","true","2595088842","2595088842","false","false",,"3621","","30972",,"Euromaidan Press","169412",,"FFFFFF","http://abs.twimg.com/images/themes/theme15/bg.png","https://abs.twimg.com/images/themes/theme15/bg.png","false",,"https://pbs.twimg.com/profile_banners/2595088842/1646062061",,"http://pbs.twimg.com/profile_images/1484146345388789765/EgfHk6gz_normal.jpg","https://pbs.twimg.com/profile_images/1484146345388789765/EgfHk6gz_normal.jpg","FFFFFF","DDEEF6","333333","false","false","false","EuromaidanPress","72791",,"none","https://t.co/liA7Wgu8Qr",,"true",,,,,,,,,,
"1509557528799195136","2022-03-31T15:45:35.000Z","434","Mick Mulvaney executed Trump’s *first* extortion of Ukraine over military aid—in 2017-18, when it was at war (as now) and (as now) desperately needed the Javelin missiles Trump was withholding to get Ukraine not to investigate Manafort—so this is a weird-ass time to hire Mulvaney",,,,,,,,,,,"1509557528799195136","13","177","https://twitter.com/SethAbramson/status/1509557528799195136",,,,"promotable_user",,,"none",,"false","2015-05-22T16:19:26.000Z","false","NYT bestselling author. Attorney. Journalist. Trump biographer. Words @CNN @BBC @CBS @CBC @HBO @WashingtonPost, etc. More at https://t.co/bGlpbdTQ7y.","false","0","2",,,"939465",,"17","false","true","3223426134","3223426134","false","false",,"8237","retrostack.substack.com","8048",,"Seth Abramson","939465",,"000000","http://abs.twimg.com/images/themes/theme1/bg.png","https://abs.twimg.com/images/themes/theme1/bg.png","false",,"https://pbs.twimg.com/profile_banners/3223426134/1646001048",,"http://pbs.twimg.com/profile_images/1498064283535560715/FtRq2idX_normal.jpg","https://pbs.twimg.com/profile_images/1498064283535560715/FtRq2idX_normal.jpg","000000","000000","000000","false","false","false","SethAbramson","119714",,"none","https://t.co/nFWEuGNTKN",,"true",,,,,,,,,,
"1509547211079790607","2022-03-31T15:08:21.000Z","100","@KyivIndependent ""Freedom to the mayor!"", ""Freedom to prisoners!"", ""Kherson region is Ukraine!"" - those present chanted.

At the end of the rally, protesters sang the anthem of Ukraine together https://t.co/oqZVmNBv58",,,,,,,,,,,"1509548159571136515","0","19","https://twitter.com/shedsquatch/status/1509548159571136515",,,,"promotable_user",,,"none",,"false","2012-11-05T14:17:07.000Z","false","🇺🇦Stay strong🇺🇦 I stand with Ukraine","false","0","53062",,,"2818",,"4998","true","true","927694782","927694782","false","false",,"17","Oregon, USA","1387",,"shedsquatch","2818",,"C0DEED","http://abs.twimg.com/images/themes/theme1/bg.png","https://abs.twimg.com/images/themes/theme1/bg.png","false",,"https://pbs.twimg.com/profile_banners/927694782/1648076967",,"http://pbs.twimg.com/profile_images/1509580615049306121/VITG3mp7_normal.jpg","https://pbs.twimg.com/profile_images/1509580615049306121/VITG3mp7_normal.jpg","C0DEED","DDEEF6","333333","true","false","false","shedsquatch","18111",,"none",,,"false",,"1462548977367359490","The Kyiv Independent","KyivIndependent",,,,,,
"1509566447240069120","2022-03-31T16:25:39.000Z","277","@SamRamani2 Ukraine has a message for @KremlinRussia_E https://t.co/cw0PZ4T9NF",,,,,,,,,,,"1509567612279218184","0","22","https://twitter.com/BarbaraLoo3/status/1509567612279218184",,,,"none",,,"none",,"false","2022-01-06T17:27:08.000Z","false","It cost zero to be a decent human being!","false","0","21362",,,"99",,"1220","false","true","1479142376165806000","1479142376165806086","false","false",,"0","","1131",,"Barbara Loo","99",,"F5F8FA",,,"false",,"https://pbs.twimg.com/profile_banners/1479142376165806086/1647631270",,"http://pbs.twimg.com/profile_images/1504175900597891075/CeqvAg8h_normal.jpg","https://pbs.twimg.com/profile_images/1504175900597891075/CeqvAg8h_normal.jpg","C0DEED","DDEEF6","333333","true","false","false","BarbaraLoo3","12338",,"none",,,"false",,"1957610664","Samuel Ramani","SamRamani2","205622130","President of Russia","KremlinRussia_E",,,
"1509512632633630721","2022-03-31T14:19:10.000Z","2383","@LindseyGrahamSC You were totally fine when Trump was happy to sell out Ukraine and constantly kissed Putin’s ass, you sniveling hypocrite.",,,,,,,,,,,"1509535779537801216","51","360","https://twitter.com/joncoopertweets/status/1509535779537801216",,,,"promotable_user",,,"none",,"false","2009-03-29T20:12:52.000Z","false","Former National Finance Chair of Draft Biden 2016, Long Island Campaign Chair for @BarackObama & Majority Leader of Suffolk County Legislature, NY. @DukeU alum","false","0","279390",,,"938298",,"64466","false","true","27493883","27493883","false","false",,"3155","New York","3602",,"Jon Cooper","938298",,"C0DEED","http://abs.twimg.com/images/themes/theme1/bg.png","https://abs.twimg.com/images/themes/theme1/bg.png","false",,"https://pbs.twimg.com/profile_banners/27493883/1636648925",,"http://pbs.twimg.com/profile_images/1495620581886210048/WH9shDmw_normal.jpg","https://pbs.twimg.com/profile_images/1495620581886210048/WH9shDmw_normal.jpg","C0DEED","DDEEF6","333333","true","false","false","joncoopertweets","323507",,"none",,,"true",,"432895323","Lindsey Graham","LindseyGrahamSC",,,,,,
"1509564792952008710","2022-03-31T16:14:27.000Z","235","Zelensky showed his desperation by releasing criminals to help #Ukraine against Russia. As many have stated: these criminals will show up in European refugee camps. What a mess.","Ukraine",,,,,,,,,,"1509564792952008710","9","61","https://twitter.com/Navsteva/status/1509564792952008710",,,,"promotable_user",,,"none",,"false","2011-12-12T21:18:53.000Z","false","Xi to Biden: ""He who tied the bell to the tiger must take it off.""

#BeltandRoad #EAEU #OBOR #BRI | World landbridge https://t.co/uFlOu8vnSW","false","0","387",,,"13177",,"1362","false","false","435260935","435260935","false","false",,"290","Empire of Lies","390",,"₦₳V𝚜𝚝é𝚟𝚊 🇷🇺 Z ~ a special military operation","13177",,"EBEBEB","http://abs.twimg.com/images/themes/theme7/bg.gif","https://abs.twimg.com/images/themes/theme7/bg.gif","false",,"https://pbs.twimg.com/profile_banners/435260935/1614882897",,"http://pbs.twimg.com/profile_images/1503527275626737666/ghzVOs3X_normal.jpg","https://pbs.twimg.com/profile_images/1503527275626737666/ghzVOs3X_normal.jpg","FFFFFF","F3F3F3","333333","false","false","false","Navsteva","15427",,"none","https://t.co/dhBywec5pP",,"false",,,,,,,,,,
"1509564301249556485","2022-03-31T16:12:30.000Z","1628","#Ukraine: A Russian convoy in #Kyiv Oblast was struck by Ukrainian indirect fire, destroying two T-72 series tanks and another armoured vehicle. We cannot verify if all of these were previously unseen. https://t.co/sijRoZG0CL","Ukraine","Kyiv",,,,,,,,,"1509564301249556485","17","198","https://twitter.com/UAWeapons/status/1509564301249556485",,,,"promotable_user",,,"none",,"false","2022-02-20T19:29:22.000Z","false","🇷🇺/🇬🇧 Debunking & Tracking Usage/Capture of Materiel in Ukraine. A @CalibreObscura & @ArmoryBazaar project. For commercial inquiries, please email.","false","0","114",,,"405296",,"11","false","false","1495480590572961800","1495480590572961792","false","false",,"5424","❄️ UAWeapons@protonmail.com","1249",,"🇺🇦 Ukraine Weapons Tracker","405296",,"F5F8FA",,,"false",,"https://pbs.twimg.com/profile_banners/1495480590572961792/1645641466",,"http://pbs.twimg.com/profile_images/1497287636448382978/wAo98Sgw_normal.jpg","https://pbs.twimg.com/profile_images/1497287636448382978/wAo98Sgw_normal.jpg","C0DEED","DDEEF6","333333","true","false","false","UAWeapons","1468",,"none",,,"false",,,,,,,,,,
"1509587825703989253","2022-03-31T17:45:59.000Z","513","8:38 pm in #Ukraine 

I have bad days &amp; not so bad days now. 
Hiding in work, in regular tasks, repeating ‘I’m fine, I’m fine’. 

In peace time I promise myself not to complain at all. In peace time most of the problems you can resolve. In war you cannot consider them as problems","Ukraine",,,,,,,,,,"1509587825703989253","44","46","https://twitter.com/strategywoman/status/1509587825703989253",,,,"none",,,"none",,"false","2021-02-24T18:13:47.000Z","false","From Ukraine. In Ukraine. Twitter war diary #warcoffee","false","0","6823",,,"94981",,"63","false","true","1364639441604800500","1364639441604800513","false","false",,"472","Kyiv, Ukraine","134",,"Yaroslava Antipina","94981",,"F5F8FA",,,"false",,"https://pbs.twimg.com/profile_banners/1364639441604800513/1645675701",,"http://pbs.twimg.com/profile_images/1499477205365182467/7Tj9EErL_normal.jpg","https://pbs.twimg.com/profile_images/1499477205365182467/7Tj9EErL_normal.jpg","C0DEED","DDEEF6","333333","true","false","false","strategywoman","1149",,"none",,,"false",,,,,,,,,,
"1509580068187688964","2022-03-31T17:15:09.000Z","424","From the people who brought you 'Homes For Ukraine'. I'd call it shambolic but that makes it sound accidental. https://t.co/569Ssj47RX",,,,,,,,,,,"1509580068187688964","13","118","https://twitter.com/mrjamesob/status/1509580068187688964","bbc.co.uk/news/uk-609435…","https://www.bbc.co.uk/news/uk-60943533","https://t.co/569Ssj47RX","promotable_user",,,"none",,"false","2010-06-06T14:46:00.000Z","false","Presenter, @LBC
Author, How Not To Be Wrong: https://t.co/ffwTNyiJVs… 
Game: https://t.co/fC7mCxgAhb
Magnitsky Award winner: https://t.co/ovqkdKOaoC","false","0","70684",,,"927293",,"3764","true","true","152656121","152656121","false","false",,"3639","London","866",,"James Oh Brien","927293",,"ACDED6","http://abs.twimg.com/images/themes/theme1/bg.png","https://abs.twimg.com/images/themes/theme1/bg.png","true",,"https://pbs.twimg.com/profile_banners/152656121/1641066504",,"http://pbs.twimg.com/profile_images/1477366885008162820/1dAPNtNO_normal.jpg","https://pbs.twimg.com/profile_images/1477366885008162820/1dAPNtNO_normal.jpg","EEEEEE","F6F6F6","333333","true","false","false","mrjamesob","83263",,"none",,,"true",,,,,,,,,,
"1509550917108084739","2022-03-31T15:19:19.000Z","194","The New York Times reporters showed the world how Ukrainian servicemen repel the Russian occupiers. Let everyone see that Ukraine is standing up against Russian aggression not just for its own sake but for the entire civilized world. #StandWithUkraine https://t.co/UnRqaZ7vN5","StandWithUkraine",,,,,,,,,,"1509550917108084739","7","56","https://twitter.com/StratcomCentre/status/1509550917108084739",,,,"promotable_user",,,"none",,"false","2021-05-02T11:35:44.000Z","false","The Centre for Strategic Communications and Information Security under the Ministry of Culture and Information Policy of Ukraine","false","0","265",,,"38571",,"298","false","false","1388819128052506600","1388819128052506627","false","false",,"1007","","832",,"Stratcom Centre UA","38571",,"F5F8FA",,,"false",,"https://pbs.twimg.com/profile_banners/1388819128052506627/1646055680",,"http://pbs.twimg.com/profile_images/1509255286388932614/WNl5yiyL_normal.jpg","https://pbs.twimg.com/profile_images/1509255286388932614/WNl5yiyL_normal.jpg","C0DEED","DDEEF6","333333","true","false","false","StratcomCentre","1552",,"none","https://t.co/JdBGoP7FrQ",,"true",,,,,,,,,,
"1509594731382198274","2022-03-31T18:13:25.000Z","12","""What’s striking is how carefully Pence charts a break from Trump on Russia and Ukraine. He does this...without uttering a single word about what Trump actually did as president on this front, which unfolded with Pence as his loyal servant throughout."" https://t.co/UH4H46dBwJ",,,,,,,,,,,"1509594731382198274","1","6","https://twitter.com/CREWcrew/status/1509594731382198274","washingtonpost.com/opinions/2022/…","https://www.washingtonpost.com/opinions/2022/03/31/mike-pence-rehab-tour-trump-ukraine/","https://t.co/UH4H46dBwJ","promotable_user",,,"none",,"false","2009-02-27T20:40:27.000Z","false","CREW uses high-impact legal actions to target government officials who sacrifice the common good to special interests.","false","0","1679",,,"454179",,"1561","false","false","22187085","22187085","false","false",,"4003","Washington, D.C.","2824",,"Citizens for Ethics","454179",,"003366","http://abs.twimg.com/images/themes/theme1/bg.png","https://abs.twimg.com/images/themes/theme1/bg.png","false",,"https://pbs.twimg.com/profile_banners/22187085/1602184450",,"http://pbs.twimg.com/profile_images/1314282774493356032/U05fnjcs_normal.jpg","https://pbs.twimg.com/profile_images/1314282774493356032/U05fnjcs_normal.jpg","CCCCCC","BED2EB","003399","false","false","false","CREWcrew","92756",,"none","http://t.co/VSJXQLgpKY",,"true",,,,,,,,,,
"1509593273404473353","2022-03-31T18:07:37.000Z","28","“I always believed that after the Chernobyl disaster, Russians weren’t insane enough to risk another one. But every day they are committing acts of terror, near or even inside each of our nuclear plants.” 

By ⁦@maxbearak⁩ in Varash, Ukraine: https://t.co/vX4Z6eYRuq",,,,,,,,,,,"1509593273404473353","1","16","https://twitter.com/ikhurshudyan/status/1509593273404473353","washingtonpost.com/world/2022/03/…","https://www.washingtonpost.com/world/2022/03/31/nuclear-power-plant-ukraine-danger/","https://t.co/vX4Z6eYRuq","promotable_user",,,"none",,"false","2009-04-12T12:55:30.000Z","false","Washington Post foreign correspondent, now in Ukraine. RTs/likes not endorsements. Изабель Хуршудян. Напишите мне: Isabelle.Khurshudyan@washpost.com","false","0","15087",,,"91565",,"1677","true","false","30645552","30645552","false","false",,"3473","Based in Moscow, now in Odesa","2777",,"Isabelle Khurshudyan","91565",,"DBE9ED","http://abs.twimg.com/images/themes/theme17/bg.gif","https://abs.twimg.com/images/themes/theme17/bg.gif","false",,"https://pbs.twimg.com/profile_banners/30645552/1617278110",,"http://pbs.twimg.com/profile_images/1179470932345266184/mUZUAcbd_normal.jpg","https://pbs.twimg.com/profile_images/1179470932345266184/mUZUAcbd_normal.jpg","DBE9ED","E6F6F9","333333","true","false","false","ikhurshudyan","78820",,"none","https://t.co/giXGqlSiEO",,"true",,"2361709243","Max Bearak","maxbearak",,,,,,
"1509240736990040071","2022-03-30T18:46:46.000Z","536","A CBS network executive seemed to lay the groundwork to hire Mick Mulvaney in a staff meeting this month, when he said the network needed to hire more Republicans to prepare for a “likely” Democratic midterm wipeout. https://t.co/g8dkQdJtcP via @jeremymbarr",,,,,,,,,,,"1509240736990040071","235","339","https://twitter.com/ElaheIzadi/status/1509240736990040071","wapo.st/3tOHgbY","https://wapo.st/3tOHgbY","https://t.co/g8dkQdJtcP","promotable_user",,,"none",,"false","2009-05-07T19:22:18.000Z","false","Media reporter @washingtonpost. Stand-up comic. Tips, ideas, notes of affirmation: elahe.izadi@washpost.com. DMs reluctantly open/message for Signal.","false","0","23033",,,"23925",,"2061","false","true","38496530","38496530","false","false",,"828","Washington, D.C.","3032",,"Elahe Izadi | الهه","23925",,"131516","http://abs.twimg.com/images/themes/theme14/bg.gif","https://abs.twimg.com/images/themes/theme14/bg.gif","true",,"https://pbs.twimg.com/profile_banners/38496530/1620076330",,"http://pbs.twimg.com/profile_images/1451183304061849600/xS0nL1Bo_normal.jpg","https://pbs.twimg.com/profile_images/1451183304061849600/xS0nL1Bo_normal.jpg","FFFFFF","EFEFEF","333333","true","false","false","ElaheIzadi","43074",,"regular","https://t.co/FURGINpMxl",,"true",,"227744268","Jeremy Barr","jeremymbarr",,,,,,
